{
  "$schema": "https://json-schema.org/draft/2020-12/schema",
  "$id": "https://example.invalid/sf2/h2-text-banks-static-fixture.schema.json",
  "type": "object", "additionalProperties": false,
  "required": ["schemaVersion", "id", "upstreamCommit", "romSha256", "table", "summary", "pointerFacts", "gamescriptFacts", "histogramFacts", "bankFacts", "copyrightBoundary", "runtimeQuestions"],
  "properties": {
    "schemaVersion": { "const": 1 }, "id": { "const": "sf2-text-banks-static-v1" },
    "upstreamCommit": { "type": "string", "pattern": "^[0-9a-f]{40}$" }, "romSha256": { "type": "string", "pattern": "^[0-9A-F]{64}$" },
    "table": { "type": "object", "minProperties": 19, "maxProperties": 19, "additionalProperties": { "type": "integer", "minimum": 0 } },
    "summary": { "type": "object", "minProperties": 23, "maxProperties": 23, "additionalProperties": { "type": "integer", "minimum": 0 } },
    "pointerFacts": { "type": "object", "minProperties": 9, "maxProperties": 9 },
    "gamescriptFacts": { "type": "object", "minProperties": 7, "maxProperties": 7 },
    "histogramFacts": { "type": "object", "minProperties": 4, "maxProperties": 4 },
    "bankFacts": { "type": "array", "minItems": 17, "maxItems": 17, "items": { "type": "object", "minProperties": 10, "maxProperties": 10 } },
    "copyrightBoundary": { "type": "object", "minProperties": 3, "maxProperties": 3 },
    "runtimeQuestions": { "type": "array", "minItems": 2, "maxItems": 2, "items": { "type": "string" } }
  }
}
